{
  "$schema": "https://json-schema.org/draft/2020-12/schema",
  "title": "Interrogation temp zone schema",
  "description": "Validation of interrogation temp zone",
  "type": "object",
  "additionalProperties": false,
  "required": ["data", "stateData", "questionnaireId"],
  "properties": {
    "data": {
      "$ref": "schema.data.json#"
    },
    "comment": {
      "type": "object"
    },
    "personalization": {
      "$ref": "schema.personalization.json#"
    },
    "questionnaireId": {
      "type": "string",
      "minLength": 1
    },
    "stateData": {
      "$ref": "#/$defs/stateData"
    }
  },
  "$defs": {
    "stateData": {
      "type": "object",
      "required": ["date", "state", "currentPage"],
      "additionalProperties": false,
      "properties": {
        "date": {
          "type": "number"
        },
        "state": {
          "enum": ["INIT", "COMPLETED", "VALIDATED", "TOEXTRACT", "EXTRACTED"]
        },
        "currentPage": {
          "type": "string",
          "minLength": 1
        }
      }
    }
  }
}